{
	"$schema": "https://raw.githubusercontent.com/cyberuni/cyber-universal-agent-plugin/refs/heads/main/schema/v1.json",
	"name": "feature-dev",
	"description": "Comprehensive feature development workflow with specialized agents for codebase exploration, architecture design, and quality review.",
	"author": { "name": "Anthropic", "email": "support@anthropic.com" },
	"agents": "./agents/",
	"commands": "./commands/",
	"vendorExtensions": {
		"claude-code": {}
	}
}
