{
  "$schema": "https://raw.githubusercontent.com/cyberuni/cyber-universal-agent-plugin/refs/heads/main/schema/v1.json",
  "name": "google-drive",
  "version": "1.0.0",
  "description": "Read and work across Google Drive, Docs, Sheets, and Slides. Query documents with natural language and perform read/write operations.",
  "author": { "name": "Google" },
  "homepage": "https://workspace.google.com",
  "keywords": ["google", "drive", "docs", "sheets", "slides"],
  "skills": "./skills/",
  "mcpServers": "./.mcp.json",
  "vendorExtensions": {
    "codex": {
      "apps": "./.app.json",
      "interface": {
        "displayName": "Google Drive",
        "shortDescription": "Connect Codex to your Google Drive, Docs, Sheets, and Slides.",
        "category": "productivity",
        "websiteURL": "https://workspace.google.com"
      }
    }
  }
}
