{
  "$schema": "https://raw.githubusercontent.com/cyberuni/cyber-universal-agent-plugin/refs/heads/main/schema/v1.json",
  "name": "code-review",
  "description": "Automated code review for pull requests using multiple specialized agents with confidence-based scoring.",
  "author": { "name": "Anthropic", "email": "support@anthropic.com" },
  "commands": "./commands/",
  "vendorExtensions": {
    "claude-code": {}
  }
}
