{
  "$schema": "https://raw.githubusercontent.com/cyberuni/cyber-universal-agent-plugin/refs/heads/main/schema/v1.json",
  "name": "figma",
  "description": "Translates Figma designs into code by creating and maintaining Code Connect template files that map design components to code snippets.",
  "author": { "name": "Figma" },
  "homepage": "https://figma.com",
  "keywords": ["design", "figma", "ui", "code-connect"],
  "skills": "./skills/",
  "mcpServers": "./.mcp.json",
  "rules": "./rules/",
  "vendorExtensions": {
    "cursor": {
      "publisher": "figma",
      "logo": "./assets/logo.png",
      "category": "design",
      "tags": ["design", "ui", "figma", "code-connect"]
    }
  }
}
